{
  "schema": "review-plan.v0",
  "pr": {
    "repo": "assistant-ui/assistant-ui",
    "number": 4025,
    "title": "feat(react-mcp): new package for user-managed MCP servers",
    "url": "https://github.com/assistant-ui/assistant-ui/pull/4025",
    "baseRef": "main",
    "headRef": "react-mcp",
    "headSha": "fa412a6d75fac49acbb74f42497ef8d8adb72f7f",
    "changedFiles": 61,
    "additions": 3892,
    "deletions": 1
  },
  "slices": [
    {
      "id": "new-package",
      "title": "New package",
      "risk": "low",
      "primaryRisk": "General package changes might have issues.",
      "decisionQuestion": "Does this package change need review beyond docs and examples?",
      "whyTheseFilesTogether": "All files are part of the new package.",
      "why": "Adds a new MCP package with docs and examples.",
      "files": [
        ".changeset/react-mcp-initial.md",
        "apps/docs/content/docs/integrations/tools/meta.json",
        "apps/docs/content/docs/integrations/tools/react-mcp.mdx",
        "examples/with-mcp/README.md",
        "examples/with-mcp/app/app/McpUI.tsx",
        "examples/with-mcp/app/app/layout.tsx",
        "examples/with-mcp/app/app/mcp/callback/page.tsx",
        "examples/with-mcp/app/app/page.tsx",
        "examples/with-mcp/app/app/providers.tsx",
        "examples/with-mcp/app/next.config.ts",
        "examples/with-mcp/app/tsconfig.json",
        "examples/with-mcp/package.json",
        "examples/with-mcp/server/server.ts",
        "examples/with-mcp/tsconfig.json",
        "packages/react-mcp/SPEC.md",
        "packages/react-mcp/package.json",
        "packages/react-mcp/src/auth/buildHeaders.ts",
        "packages/react-mcp/src/auth/createOAuthProvider.ts",
        "packages/react-mcp/src/auth/types.ts",
        "packages/react-mcp/src/connector.ts",
        "packages/react-mcp/src/context/McpConnectorByIndexProvider.tsx",
        "packages/react-mcp/src/context/McpCustomServerByIndexProvider.tsx",
        "packages/react-mcp/src/context/McpServerByIdProvider.tsx",
        "packages/react-mcp/src/hooks/useMcpOAuthCallback.tsx",
        "packages/react-mcp/src/index.ts",
        "packages/react-mcp/src/mcp-scope.ts",
        "packages/react-mcp/src/primitives/addForm.ts",
        "packages/react-mcp/src/primitives/addForm/McpAddFormAuthFields.tsx",
        "packages/react-mcp/src/primitives/addForm/McpAddFormAuthSelect.tsx",
        "packages/react-mcp/src/primitives/addForm/McpAddFormCancel.tsx",
        "packages/react-mcp/src/primitives/addForm/McpAddFormError.tsx",
        "packages/react-mcp/src/primitives/addForm/McpAddFormNameField.tsx",
        "packages/react-mcp/src/primitives/addForm/McpAddFormRoot.tsx",
        "packages/react-mcp/src/primitives/addForm/McpAddFormSubmit.tsx",
        "packages/react-mcp/src/primitives/addForm/McpAddFormUrlField.tsx",
        "packages/react-mcp/src/primitives/addForm/context.tsx",
        "packages/react-mcp/src/primitives/manager.ts",
        "packages/react-mcp/src/primitives/manager/McpManagerAddCustomTrigger.tsx",
        "packages/react-mcp/src/primitives/manager/McpManagerConnectors.tsx",
        "packages/react-mcp/src/primitives/manager/McpManagerCustomServers.tsx",
        "packages/react-mcp/src/primitives/manager/McpManagerRoot.tsx",
        "packages/react-mcp/src/primitives/server.ts",
        "packages/react-mcp/src/primitives/server/McpServerConnectButton.tsx",
        "packages/react-mcp/src/primitives/server/McpServerDisconnectButton.tsx",
        "packages/react-mcp/src/primitives/server/McpServerError.tsx",
        "packages/react-mcp/src/primitives/server/McpServerIcon.tsx",
        "packages/react-mcp/src/primitives/server/McpServerName.tsx",
        "packages/react-mcp/src/primitives/server/McpServerOAuthLink.tsx",
        "packages/react-mcp/src/primitives/server/McpServerRemoveButton.tsx",
        "packages/react-mcp/src/primitives/server/McpServerRoot.tsx",
        "packages/react-mcp/src/primitives/server/McpServerStatus.tsx",
        "packages/react-mcp/src/primitives/server/McpServerToolName.tsx",
        "packages/react-mcp/src/primitives/server/McpServerTools.tsx",
        "packages/react-mcp/src/resources/McpManagerResource.ts",
        "packages/react-mcp/src/resources/McpServerResource.ts",
        "packages/react-mcp/src/resources/storage/McpCustomStorage.ts",
        "packages/react-mcp/src/resources/storage/McpLocalStorage.ts",
        "packages/react-mcp/src/resources/storage/McpMemoryStorage.ts",
        "packages/react-mcp/src/resources/storage/types.ts",
        "packages/react-mcp/tsconfig.json",
        "pnpm-lock.yaml"
      ],
      "acceptConditions": ["Accept if the package looks good."],
      "commentConditions": ["Comment if something looks wrong."],
      "evidence": ["parsed the diff"],
      "suggestedDecision": "Approve with no comments."
    }
  ],
  "hiddenGroups": [],
  "fallbackFileList": []
}
